{
  "builder_version": "vnext-readiness-candidate-1",
  "character_schema_id": "saku.character",
  "character_schema_version": "vnext-1.0",
  "platform": "Windows",
  "validation_summary": {
    "overall": "NOT_CONFIGURED",
    "counts": {
      "INVALID": 0,
      "UNKNOWN": 0,
      "UNSUPPORTED": 0,
      "NOT_CONFIGURED": 1,
      "EXTERNAL_EVIDENCE_REQUIRED": 0
    },
    "layers": [
      "STRUCTURAL_VALIDATION",
      "DETERMINISTIC_CONFORMANCE",
      "AUTHORING_POLICY_CONFORMANCE"
    ]
  },
  "validation_codes": [
    "COMPATIBILITY_DECLARATION_NOT_CONFIGURED"
  ],
  "compatibility": {
    "supported_schema_id": "saku.character",
    "supported_schema_versions": [
      "vnext-1.0"
    ],
    "result": "NOT_CONFIGURED"
  },
  "extension_declarations": [],
  "unsupported_features": [],
  "error_context": [],
  "provenance": {
    "status": "NOT_CONFIGURED"
  }
}
